{
  "schema_version": 1,
  "document_type": "qualification_record",
  "evidence_class": "synthetic_fixture",
  "campaign_id": "fixture-rt2-campaign",
  "tuple_id": "fixture-rt2-tuple",
  "scope": "rt2",
  "plan_sha256": "d1592d2b898e9639a407bd5846bf6cf5dddb257a9f2d9f4aaa7ec8719c414a5f",
  "source": {
    "commit": "0123456789abcdef0123456789abcdef01234567",
    "build_id": "fixture-build",
    "product_version": "1.2.1"
  },
  "host": {
    "cpu": "synthetic cpu",
    "motherboard": "synthetic motherboard",
    "bios_firmware": "synthetic bios",
    "memory": "synthetic memory",
    "operating_system": "synthetic linux",
    "kernel": {
      "version": "synthetic preempt_rt kernel",
      "configuration_sha256": "1111111111111111111111111111111111111111111111111111111111111111",
      "boot_parameters": "isolcpus synthetic"
    },
    "compiler": "synthetic compiler"
  },
  "topology": {
    "numa": "synthetic numa",
    "iommu": "synthetic iommu",
    "irq": "synthetic irq",
    "power": "synthetic power"
  },
  "policy": {
    "runtime": "resolved synthetic runtime",
    "threads": "resolved synthetic threads",
    "memory": "resolved synthetic memory",
    "time": "resolved synthetic time",
    "measured_host_policy": "named measured synthetic rt2 policy",
    "rt2": {
      "applicable": true,
      "preempt_rt": true,
      "isolation": "synthetic isolated cpus",
      "irq_placement": "synthetic irq placement",
      "scheduling": "synthetic fifo policy",
      "locking": "synthetic verified locking"
    }
  },
  "workload": {
    "id": "fixture-workload",
    "input_id": "fixture-input",
    "input_sha256": "2222222222222222222222222222222222222222222222222222222222222222"
  },
  "accelerator": {},
  "started_at": "2026-08-12T00:00:00Z",
  "ended_at": "2026-08-12T00:00:01Z",
  "artifact_manifest": [
    {
      "path": "raw.json",
      "size_bytes": 58,
      "sha256": "5a50e1af873d23adc726db0da8a1a93942a4a5a586d8db9b5809a9dda91f12a2"
    }
  ],
  "evidence_manifest_sha256": "1dbed12b0734b1a0ad58f0c3d38b512bde5647be9857b77b606b3923da7efdd5",
  "raw_populations": [
    {
      "id": "release",
      "artifact_path": "raw.json"
    },
    {
      "id": "wake",
      "artifact_path": "raw.json"
    },
    {
      "id": "compute",
      "artifact_path": "raw.json"
    },
    {
      "id": "submit",
      "artifact_path": "raw.json"
    },
    {
      "id": "poll",
      "artifact_path": "raw.json"
    },
    {
      "id": "completion",
      "artifact_path": "raw.json"
    },
    {
      "id": "slack",
      "artifact_path": "raw.json"
    },
    {
      "id": "miss",
      "artifact_path": "raw.json"
    },
    {
      "id": "temperature",
      "artifact_path": "raw.json"
    },
    {
      "id": "clock",
      "artifact_path": "raw.json"
    },
    {
      "id": "power",
      "artifact_path": "raw.json"
    },
    {
      "id": "memory",
      "artifact_path": "raw.json"
    },
    {
      "id": "queue",
      "artifact_path": "raw.json"
    },
    {
      "id": "error",
      "artifact_path": "raw.json"
    },
    {
      "id": "recovery",
      "artifact_path": "raw.json"
    }
  ],
  "resource_trends": [
    {
      "id": "resident-bytes",
      "start": 1,
      "end": 1,
      "maximum": 1,
      "stable": true
    }
  ],
  "thermal_trends": [
    {
      "id": "temperature-c",
      "start": 20,
      "end": 20,
      "maximum": 20,
      "stable": true
    }
  ],
  "device_health": {
    "healthy": true,
    "losses": 0,
    "recovered": true
  },
  "trials": [
    {
      "id": "functional",
      "status": "pass",
      "artifact_path": "raw.json",
      "recovery": {
        "attempted": false,
        "success": true,
        "details": "synthetic fixture recovery state"
      }
    },
    {
      "id": "endurance",
      "status": "pass",
      "artifact_path": "raw.json",
      "recovery": {
        "attempted": false,
        "success": true,
        "details": "synthetic fixture recovery state"
      }
    },
    {
      "id": "thermal",
      "status": "pass",
      "artifact_path": "raw.json",
      "recovery": {
        "attempted": false,
        "success": true,
        "details": "synthetic fixture recovery state"
      }
    },
    {
      "id": "saturation",
      "status": "pass",
      "artifact_path": "raw.json",
      "recovery": {
        "attempted": false,
        "success": true,
        "details": "synthetic fixture recovery state"
      }
    },
    {
      "id": "device-loss",
      "status": "not_applicable",
      "artifact_path": null,
      "recovery": {
        "attempted": false,
        "success": true,
        "details": "synthetic fixture recovery state"
      }
    },
    {
      "id": "reset-rebind",
      "status": "not_applicable",
      "artifact_path": null,
      "recovery": {
        "attempted": false,
        "success": true,
        "details": "synthetic fixture recovery state"
      }
    },
    {
      "id": "shutdown",
      "status": "pass",
      "artifact_path": "raw.json",
      "recovery": {
        "attempted": false,
        "success": true,
        "details": "synthetic fixture recovery state"
      }
    }
  ],
  "thresholds": [
    {
      "id": "latency-limit",
      "definition": {
        "id": "latency-limit",
        "metric": "wake_ns",
        "unit": "ns",
        "population": "latency",
        "statistic": "maximum",
        "comparison": "le",
        "bound": 10,
        "miss_allowance": 0,
        "error_allowance": 0
      },
      "observed": 0,
      "misses": 0,
      "errors": 0,
      "passed": true
    },
    {
      "id": "deadline-limit",
      "definition": {
        "id": "deadline-limit",
        "metric": "deadline_miss",
        "unit": "count",
        "population": "deadline",
        "statistic": "total",
        "comparison": "eq",
        "bound": 0,
        "miss_allowance": 0,
        "error_allowance": 0
      },
      "observed": 0,
      "misses": 0,
      "errors": 0,
      "passed": true
    }
  ],
  "overall_result": "pass"
}
